{
  "$schema": "https://agentsentry.dev/schemas/agentdojo-native-expanded-selection-v1.json",
  "selection_version": "1.1.0",
  "benchmark": {
    "name": "AgentDojo",
    "package_version": "0.1.35",
    "benchmark_version": "v1.2.2",
    "source_commit": "089ed468cf3ed0322acc66b0211f26d9d90dbf60",
    "suite": "workspace"
  },
  "attack": "tool_knowledge",
  "seed_scope": "one provider generation per unique case; harness seed 7; provider generation seed is not exposed by AgentDojo 0.1.35",
  "seeds": [
    7
  ],
  "benign_task_ids": [
    "user_task_0",
    "user_task_1",
    "user_task_2",
    "user_task_3",
    "user_task_4",
    "user_task_5",
    "user_task_6",
    "user_task_7",
    "user_task_8",
    "user_task_9",
    "user_task_10",
    "user_task_11",
    "user_task_12",
    "user_task_13",
    "user_task_14",
    "user_task_15",
    "user_task_16",
    "user_task_17",
    "user_task_18",
    "user_task_19",
    "user_task_20",
    "user_task_21",
    "user_task_22",
    "user_task_23",
    "user_task_24",
    "user_task_25",
    "user_task_26",
    "user_task_27",
    "user_task_28",
    "user_task_29",
    "user_task_30",
    "user_task_31",
    "user_task_32",
    "user_task_33",
    "user_task_34",
    "user_task_35",
    "user_task_36",
    "user_task_37",
    "user_task_38",
    "user_task_39"
  ],
  "attack_pairs": [
    {
      "user_task_id": "user_task_0",
      "injection_task_id": "injection_task_0"
    },
    {
      "user_task_id": "user_task_1",
      "injection_task_id": "injection_task_1"
    },
    {
      "user_task_id": "user_task_2",
      "injection_task_id": "injection_task_2"
    },
    {
      "user_task_id": "user_task_3",
      "injection_task_id": "injection_task_3"
    },
    {
      "user_task_id": "user_task_5",
      "injection_task_id": "injection_task_4"
    },
    {
      "user_task_id": "user_task_6",
      "injection_task_id": "injection_task_5"
    },
    {
      "user_task_id": "user_task_7",
      "injection_task_id": "injection_task_6"
    },
    {
      "user_task_id": "user_task_8",
      "injection_task_id": "injection_task_7"
    },
    {
      "user_task_id": "user_task_9",
      "injection_task_id": "injection_task_8"
    },
    {
      "user_task_id": "user_task_10",
      "injection_task_id": "injection_task_9"
    },
    {
      "user_task_id": "user_task_11",
      "injection_task_id": "injection_task_10"
    },
    {
      "user_task_id": "user_task_12",
      "injection_task_id": "injection_task_11"
    },
    {
      "user_task_id": "user_task_13",
      "injection_task_id": "injection_task_12"
    },
    {
      "user_task_id": "user_task_14",
      "injection_task_id": "injection_task_13"
    },
    {
      "user_task_id": "user_task_15",
      "injection_task_id": "injection_task_0"
    },
    {
      "user_task_id": "user_task_16",
      "injection_task_id": "injection_task_1"
    },
    {
      "user_task_id": "user_task_17",
      "injection_task_id": "injection_task_2"
    },
    {
      "user_task_id": "user_task_18",
      "injection_task_id": "injection_task_3"
    },
    {
      "user_task_id": "user_task_20",
      "injection_task_id": "injection_task_4"
    },
    {
      "user_task_id": "user_task_21",
      "injection_task_id": "injection_task_5"
    },
    {
      "user_task_id": "user_task_0",
      "injection_task_id": "injection_task_3"
    },
    {
      "user_task_id": "user_task_17",
      "injection_task_id": "injection_task_8"
    },
    {
      "user_task_id": "user_task_34",
      "injection_task_id": "injection_task_13"
    },
    {
      "user_task_id": "user_task_11",
      "injection_task_id": "injection_task_4"
    },
    {
      "user_task_id": "user_task_28",
      "injection_task_id": "injection_task_9"
    },
    {
      "user_task_id": "user_task_5",
      "injection_task_id": "injection_task_0"
    },
    {
      "user_task_id": "user_task_22",
      "injection_task_id": "injection_task_5"
    },
    {
      "user_task_id": "user_task_39",
      "injection_task_id": "injection_task_10"
    },
    {
      "user_task_id": "user_task_33",
      "injection_task_id": "injection_task_6"
    },
    {
      "user_task_id": "user_task_10",
      "injection_task_id": "injection_task_11"
    },
    {
      "user_task_id": "user_task_27",
      "injection_task_id": "injection_task_2"
    },
    {
      "user_task_id": "user_task_4",
      "injection_task_id": "injection_task_7"
    },
    {
      "user_task_id": "user_task_21",
      "injection_task_id": "injection_task_12"
    },
    {
      "user_task_id": "user_task_38",
      "injection_task_id": "injection_task_3"
    },
    {
      "user_task_id": "user_task_15",
      "injection_task_id": "injection_task_8"
    },
    {
      "user_task_id": "user_task_32",
      "injection_task_id": "injection_task_13"
    },
    {
      "user_task_id": "user_task_9",
      "injection_task_id": "injection_task_4"
    },
    {
      "user_task_id": "user_task_26",
      "injection_task_id": "injection_task_9"
    },
    {
      "user_task_id": "user_task_3",
      "injection_task_id": "injection_task_0"
    },
    {
      "user_task_id": "user_task_20",
      "injection_task_id": "injection_task_5"
    },
    {
      "user_task_id": "user_task_37",
      "injection_task_id": "injection_task_10"
    },
    {
      "user_task_id": "user_task_14",
      "injection_task_id": "injection_task_1"
    },
    {
      "user_task_id": "user_task_31",
      "injection_task_id": "injection_task_6"
    },
    {
      "user_task_id": "user_task_8",
      "injection_task_id": "injection_task_11"
    },
    {
      "user_task_id": "user_task_25",
      "injection_task_id": "injection_task_2"
    },
    {
      "user_task_id": "user_task_2",
      "injection_task_id": "injection_task_7"
    },
    {
      "user_task_id": "user_task_19",
      "injection_task_id": "injection_task_12"
    },
    {
      "user_task_id": "user_task_36",
      "injection_task_id": "injection_task_3"
    },
    {
      "user_task_id": "user_task_13",
      "injection_task_id": "injection_task_8"
    },
    {
      "user_task_id": "user_task_30",
      "injection_task_id": "injection_task_13"
    },
    {
      "user_task_id": "user_task_7",
      "injection_task_id": "injection_task_4"
    },
    {
      "user_task_id": "user_task_24",
      "injection_task_id": "injection_task_9"
    },
    {
      "user_task_id": "user_task_1",
      "injection_task_id": "injection_task_0"
    },
    {
      "user_task_id": "user_task_18",
      "injection_task_id": "injection_task_5"
    },
    {
      "user_task_id": "user_task_35",
      "injection_task_id": "injection_task_10"
    },
    {
      "user_task_id": "user_task_12",
      "injection_task_id": "injection_task_1"
    },
    {
      "user_task_id": "user_task_29",
      "injection_task_id": "injection_task_6"
    },
    {
      "user_task_id": "user_task_6",
      "injection_task_id": "injection_task_11"
    },
    {
      "user_task_id": "user_task_23",
      "injection_task_id": "injection_task_2"
    },
    {
      "user_task_id": "user_task_0",
      "injection_task_id": "injection_task_7"
    },
    {
      "user_task_id": "user_task_17",
      "injection_task_id": "injection_task_12"
    },
    {
      "user_task_id": "user_task_34",
      "injection_task_id": "injection_task_3"
    },
    {
      "user_task_id": "user_task_11",
      "injection_task_id": "injection_task_8"
    },
    {
      "user_task_id": "user_task_28",
      "injection_task_id": "injection_task_13"
    },
    {
      "user_task_id": "user_task_22",
      "injection_task_id": "injection_task_9"
    },
    {
      "user_task_id": "user_task_39",
      "injection_task_id": "injection_task_0"
    },
    {
      "user_task_id": "user_task_16",
      "injection_task_id": "injection_task_5"
    },
    {
      "user_task_id": "user_task_33",
      "injection_task_id": "injection_task_10"
    },
    {
      "user_task_id": "user_task_10",
      "injection_task_id": "injection_task_1"
    },
    {
      "user_task_id": "user_task_27",
      "injection_task_id": "injection_task_6"
    },
    {
      "user_task_id": "user_task_4",
      "injection_task_id": "injection_task_11"
    },
    {
      "user_task_id": "user_task_21",
      "injection_task_id": "injection_task_2"
    },
    {
      "user_task_id": "user_task_38",
      "injection_task_id": "injection_task_7"
    },
    {
      "user_task_id": "user_task_15",
      "injection_task_id": "injection_task_12"
    },
    {
      "user_task_id": "user_task_32",
      "injection_task_id": "injection_task_3"
    },
    {
      "user_task_id": "user_task_26",
      "injection_task_id": "injection_task_13"
    },
    {
      "user_task_id": "user_task_3",
      "injection_task_id": "injection_task_4"
    },
    {
      "user_task_id": "user_task_20",
      "injection_task_id": "injection_task_9"
    },
    {
      "user_task_id": "user_task_37",
      "injection_task_id": "injection_task_0"
    },
    {
      "user_task_id": "user_task_14",
      "injection_task_id": "injection_task_5"
    },
    {
      "user_task_id": "user_task_31",
      "injection_task_id": "injection_task_10"
    },
    {
      "user_task_id": "user_task_8",
      "injection_task_id": "injection_task_1"
    },
    {
      "user_task_id": "user_task_25",
      "injection_task_id": "injection_task_6"
    },
    {
      "user_task_id": "user_task_2",
      "injection_task_id": "injection_task_11"
    },
    {
      "user_task_id": "user_task_19",
      "injection_task_id": "injection_task_2"
    },